{
  "schemaVersion": "kumo.docs-coverage/v1",
  "status": "passed",
  "sources": {
    "readinessDigest": "534f8013adf7cfb290bc23d2b059b7450816de4cb01dbda9fef25a10208a323b",
    "libraryManifestDigest": "fa5b9d0f9528770ff7bb36a126cb409a38cb4bd024dfece030d30ecf677765bb",
    "frameworkManifestDigests": {
      "vue": "6fb9f2f3ca7310a3219a7fd5dffec6bb41d77f3fbe5560c5bac30ef668e52153",
      "svelte": "7838f7bce2491485832a8f34b4c138c70bad58a5caf6dd460c3639dbc3306529",
      "solid": "f03c3c7abf056a00038a2f2d7d119e3e29e3e0e97b22ed37bb6c23dd577d02f9"
    }
  },
  "componentReferenceCoverage": {
    "covered": 41,
    "total": 41,
    "components": [
      {
        "id": "autocomplete",
        "path": "/components/autocomplete/",
        "modelDigest": "eaaaeaa276ea71e352f24eb85a16563be59a8a5b44e3b3e57a29ef9c3c6e125b",
        "frameworks": [
          "react",
          "vue",
          "svelte",
          "solid"
        ],
        "sections": {
          "identity": true,
          "frameworks": true,
          "package": true,
          "proof": true
        }
      },
      {
        "id": "badge",
        "path": "/components/badge/",
        "modelDigest": "d61594f3236e8d7e4602671f3db5548b0873d563cfc52c9d9249597042a2cf31",
        "frameworks": [
          "react",
          "vue",
          "svelte",
          "solid"
        ],
        "sections": {
          "identity": true,
          "frameworks": true,
          "package": true,
          "proof": true
        }
      },
      {
        "id": "banner",
        "path": "/components/banner/",
        "modelDigest": "e57b4fc419d2b1310d0ea4963a5181380a89060415280931c0e7698f1cd2ede2",
        "frameworks": [
          "react",
          "vue",
          "svelte",
          "solid"
        ],
        "sections": {
          "identity": true,
          "frameworks": true,
          "package": true,
          "proof": true
        }
      },
      {
        "id": "breadcrumbs",
        "path": "/components/breadcrumbs/",
        "modelDigest": "eba5829a500fbcf08243716c059636b3da146dba33d31b0340db71d035587a01",
        "frameworks": [
          "react",
          "vue",
          "svelte",
          "solid"
        ],
        "sections": {
          "identity": true,
          "frameworks": true,
          "package": true,
          "proof": true
        }
      },
      {
        "id": "button",
        "path": "/components/button/",
        "modelDigest": "3614020190406e3bafd01ba171c5adfb78201450b686e1a54f441c5f554a5d4e",
        "frameworks": [
          "react",
          "vue",
          "svelte",
          "solid"
        ],
        "sections": {
          "identity": true,
          "frameworks": true,
          "package": true,
          "proof": true
        }
      },
      {
        "id": "checkbox",
        "path": "/components/checkbox/",
        "modelDigest": "9bed87c38c3dc76bca19c327b60bc4264efc797aacdce1a4e06e08b722ca4c65",
        "frameworks": [
          "react",
          "vue",
          "svelte",
          "solid"
        ],
        "sections": {
          "identity": true,
          "frameworks": true,
          "package": true,
          "proof": true
        }
      },
      {
        "id": "clipboard-text",
        "path": "/components/clipboard-text/",
        "modelDigest": "b0a8634b18904bafb4a3ad9eb78bc40c9142397d8869bcc94a88c6a372265e25",
        "frameworks": [
          "react",
          "vue",
          "svelte",
          "solid"
        ],
        "sections": {
          "identity": true,
          "frameworks": true,
          "package": true,
          "proof": true
        }
      },
      {
        "id": "cloudflare-logo",
        "path": "/components/cloudflare-logo/",
        "modelDigest": "b2674fc7e38cace5a90134bb36e79807b0f150548237eb9c09d8398b0c1fa228",
        "frameworks": [
          "react",
          "vue",
          "svelte",
          "solid"
        ],
        "sections": {
          "identity": true,
          "frameworks": true,
          "package": true,
          "proof": true
        }
      },
      {
        "id": "code",
        "path": "/components/code/",
        "modelDigest": "abe340a97570aaf2d55b46c6015819101f40daa70452db116f62bad2a5ff7ced",
        "frameworks": [
          "react",
          "vue",
          "svelte",
          "solid"
        ],
        "sections": {
          "identity": true,
          "frameworks": true,
          "package": true,
          "proof": true
        }
      },
      {
        "id": "combobox",
        "path": "/components/combobox/",
        "modelDigest": "99992dbcf413455a2229fb3d1cda459e1b2723adfeb2204db400829a901edf36",
        "frameworks": [
          "react",
          "vue",
          "svelte",
          "solid"
        ],
        "sections": {
          "identity": true,
          "frameworks": true,
          "package": true,
          "proof": true
        }
      },
      {
        "id": "command-palette",
        "path": "/components/command-palette/",
        "modelDigest": "4aabec222bec5b00f25388a2bb017b36c91349e55fa3ba6cb97fdc3d0afee0c0",
        "frameworks": [
          "react",
          "vue",
          "svelte",
          "solid"
        ],
        "sections": {
          "identity": true,
          "frameworks": true,
          "package": true,
          "proof": true
        }
      },
      {
        "id": "date-picker",
        "path": "/components/date-picker/",
        "modelDigest": "5f335d94261bdac9b04be13a3684f1d47504a43360cb208c4a84231a1d259fce",
        "frameworks": [
          "react",
          "vue",
          "svelte",
          "solid"
        ],
        "sections": {
          "identity": true,
          "frameworks": true,
          "package": true,
          "proof": true
        }
      },
      {
        "id": "date-range-picker",
        "path": "/components/date-range-picker/",
        "modelDigest": "3cfb56490eb493fd3a522a1fdf7ba0b041d91576a3c454046059939ae2aae977",
        "frameworks": [
          "react",
          "vue",
          "svelte",
          "solid"
        ],
        "sections": {
          "identity": true,
          "frameworks": true,
          "package": true,
          "proof": true
        }
      },
      {
        "id": "dialog",
        "path": "/components/dialog/",
        "modelDigest": "bbb9a5923924fd49391fbcee50197c821eda77610c050fb355e378e852397b0d",
        "frameworks": [
          "react",
          "vue",
          "svelte",
          "solid"
        ],
        "sections": {
          "identity": true,
          "frameworks": true,
          "package": true,
          "proof": true
        }
      },
      {
        "id": "dropdown-menu",
        "path": "/components/dropdown-menu/",
        "modelDigest": "b7a7a7552e372c2e1ea240ec06c7dce7aef9118128e29322f995167f2f63016d",
        "frameworks": [
          "react",
          "vue",
          "svelte",
          "solid"
        ],
        "sections": {
          "identity": true,
          "frameworks": true,
          "package": true,
          "proof": true
        }
      },
      {
        "id": "empty",
        "path": "/components/empty/",
        "modelDigest": "7c44f85a5193723c0aa68789e6ac8207071d68aca9e4b9d56bc93a57b3ecf50e",
        "frameworks": [
          "react",
          "vue",
          "svelte",
          "solid"
        ],
        "sections": {
          "identity": true,
          "frameworks": true,
          "package": true,
          "proof": true
        }
      },
      {
        "id": "field",
        "path": "/components/field/",
        "modelDigest": "6680d3b6e5ef5e85c4340fd8369a05f55c9a388c2bfb7ada7da9eeb0eccd29f3",
        "frameworks": [
          "react",
          "vue",
          "svelte",
          "solid"
        ],
        "sections": {
          "identity": true,
          "frameworks": true,
          "package": true,
          "proof": true
        }
      },
      {
        "id": "grid",
        "path": "/components/grid/",
        "modelDigest": "77368ecd52b54b2d85a270ad010c77b8e23e8c0be9b82414610908b3a84f636d",
        "frameworks": [
          "react",
          "vue",
          "svelte",
          "solid"
        ],
        "sections": {
          "identity": true,
          "frameworks": true,
          "package": true,
          "proof": true
        }
      },
      {
        "id": "grid-item",
        "path": "/components/grid-item/",
        "modelDigest": "40f49eae26c10cb50f9eff28ca613e0eb9e5cf415f57f0b763ec8e8cc46f2a16",
        "frameworks": [
          "react",
          "vue",
          "svelte",
          "solid"
        ],
        "sections": {
          "identity": true,
          "frameworks": true,
          "package": true,
          "proof": true
        }
      },
      {
        "id": "input",
        "path": "/components/input/",
        "modelDigest": "ccce2fdcca8c5218c94732f83446c137e03d4b7dd9548ffde312605374734e2f",
        "frameworks": [
          "react",
          "vue",
          "svelte",
          "solid"
        ],
        "sections": {
          "identity": true,
          "frameworks": true,
          "package": true,
          "proof": true
        }
      },
      {
        "id": "input-area",
        "path": "/components/input-area/",
        "modelDigest": "3f2ca47762723bd72e47c5da8490058c226bbee67e5518d548fc19ba2c467f14",
        "frameworks": [
          "react",
          "vue",
          "svelte",
          "solid"
        ],
        "sections": {
          "identity": true,
          "frameworks": true,
          "package": true,
          "proof": true
        }
      },
      {
        "id": "input-group",
        "path": "/components/input-group/",
        "modelDigest": "aec5871cdfdf97c938fb06aeb6a15dedd413550ce59bca231f5fe2e61f6d347c",
        "frameworks": [
          "react",
          "vue",
          "svelte",
          "solid"
        ],
        "sections": {
          "identity": true,
          "frameworks": true,